{
  "$schema": "https://json-schema.org/draft/2020-12/schema",
  "$id": "urn:speculo:ops:verification-state:v1",
  "title": "Ops Verification State",
  "type": "object",
  "required": ["schema_version", "artifact", "scope", "project_id", "change", "attempt_id", "captured_at", "target_profile_path", "target_profile_digest", "identity_results", "gates", "artifacts", "services", "probes", "convergence", "data_protection", "recovery", "retained_artifacts", "risks", "verdict"],
  "properties": {
    "schema_version": {"const": 1},
    "artifact": {"const": "ops-verification-state"},
    "scope": {"enum": ["global", "project"]},
    "project_id": {"type": ["string", "null"], "pattern": "^[a-z0-9]+(?:-[a-z0-9]+)*$"},
    "change": {"type": "string"},
    "attempt_id": {"type": "string", "pattern": "^ATTEMPT-[0-9]{3}$"},
    "captured_at": {"type": "string", "format": "date-time"},
    "target_profile_path": {"type": ["string", "null"]},
    "target_profile_digest": {"type": ["string", "null"], "pattern": "^[a-f0-9]{64}$"},
    "identity_results": {"type": "array", "items": {"type": "object", "required": ["assertion_id", "comparison", "actual", "matched", "evidence"], "properties": {"assertion_id": {"type": "string", "pattern": "^ID[0-9]{3}$"}, "comparison": {"enum": ["exact", "ordered-list", "set", "digest"]}, "actual": {"anyOf": [{"type": "string", "minLength": 1}, {"type": "array", "items": {"type": "string", "minLength": 1}, "minItems": 1, "uniqueItems": true}]}, "matched": {"type": "boolean"}, "evidence": {"type": "array", "items": {"type": "string", "minLength": 1}, "minItems": 1, "uniqueItems": true}}, "additionalProperties": false}},
    "gates": {"type": "array", "items": {"type": "object", "required": ["id", "sequence", "status", "started_at", "ended_at", "evidence"], "properties": {"id": {"type": "string", "pattern": "^G[0-9]{2}$"}, "sequence": {"type": "integer", "minimum": 1}, "status": {"enum": ["passed", "failed", "blocked", "skipped"]}, "started_at": {"type": "string", "format": "date-time"}, "ended_at": {"type": "string", "format": "date-time"}, "evidence": {"type": "array", "items": {"type": "string", "minLength": 1}, "uniqueItems": true}}, "additionalProperties": false}},
    "artifacts": {"type": "array", "items": {"type": "object", "required": ["requirement_id", "immutable_digest", "target_ref", "server_verified", "matched", "evidence"], "properties": {"requirement_id": {"type": "string", "pattern": "^AR[0-9]{3}$"}, "immutable_digest": {"type": "string", "pattern": "^(?:sha256:)?[a-f0-9]{64}$"}, "target_ref": {"type": "string", "minLength": 1}, "server_verified": {"type": "boolean"}, "matched": {"type": "boolean"}, "evidence": {"type": "array", "items": {"type": "string", "minLength": 1}, "uniqueItems": true}}, "additionalProperties": false}},
    "services": {"type": "array", "items": {"type": "object", "required": ["id", "status", "immutable_ref", "restart_count", "runtime_digest", "evidence"], "properties": {"id": {"type": "string", "minLength": 1}, "status": {"enum": ["healthy", "running", "degraded", "failed", "absent"]}, "immutable_ref": {"type": ["string", "null"]}, "restart_count": {"type": "integer", "minimum": 0}, "runtime_digest": {"type": ["string", "null"]}, "evidence": {"type": "array", "items": {"type": "string", "minLength": 1}, "uniqueItems": true}}, "additionalProperties": false}},
    "probes": {"type": "array", "items": {"type": "object", "required": ["verification_id", "ok", "http_status", "business_code", "authenticated", "consecutive_successes", "elapsed_seconds", "transient_failures", "evidence"], "properties": {"verification_id": {"type": "string", "pattern": "^VR[0-9]{3}$"}, "ok": {"type": "boolean"}, "http_status": {"type": ["integer", "null"]}, "business_code": {"type": ["integer", "string", "null"]}, "authenticated": {"type": ["boolean", "null"]}, "consecutive_successes": {"type": "integer", "minimum": 0}, "elapsed_seconds": {"type": "number", "minimum": 0}, "transient_failures": {"type": "array", "items": {"type": "string"}}, "evidence": {"type": "array", "items": {"type": "string", "minLength": 1}, "uniqueItems": true}}, "additionalProperties": false}},
    "convergence": {"type": "array", "items": {"type": "object", "required": ["group", "member_ids", "digests", "matched", "evidence"], "properties": {"group": {"type": "string", "minLength": 1}, "member_ids": {"type": "array", "items": {"type": "string", "minLength": 1}, "minItems": 2, "uniqueItems": true}, "digests": {"type": "array", "items": {"type": "string", "minLength": 1}, "minItems": 2}, "matched": {"type": "boolean"}, "evidence": {"type": "array", "items": {"type": "string", "minLength": 1}, "uniqueItems": true}}, "additionalProperties": false}},
    "data_protection": {"type": "array", "items": {"type": "object", "required": ["protection_id", "status", "evidence_path", "evidence_digest", "readability_verified", "restore_verified"], "properties": {"protection_id": {"type": "string", "pattern": "^DP[0-9]{3}$"}, "status": {"enum": ["verified", "waived", "not-required", "failed"]}, "evidence_path": {"type": ["string", "null"]}, "evidence_digest": {"type": ["string", "null"], "pattern": "^[a-f0-9]{64}$"}, "readability_verified": {"type": "boolean"}, "restore_verified": {"type": "boolean"}}, "additionalProperties": false}},
    "recovery": {"type": "object", "required": ["strategy", "previous_release_ref", "rollback_operation_refs", "material_refs", "compatibility_verified", "data_restore_authorized", "evidence"], "properties": {"strategy": {"enum": ["restore-previous", "reverse-change", "forward-fix", "not-applicable"]}, "previous_release_ref": {"type": ["string", "null"]}, "rollback_operation_refs": {"type": "array", "items": {"type": "string", "pattern": "^OP[0-9]{3}$"}, "uniqueItems": true}, "material_refs": {"type": "array", "items": {"type": "string", "minLength": 1}, "uniqueItems": true}, "compatibility_verified": {"type": "boolean"}, "data_restore_authorized": {"type": ["boolean", "null"]}, "evidence": {"type": "array", "items": {"type": "string", "minLength": 1}, "uniqueItems": true}}, "additionalProperties": false},
    "retained_artifacts": {"type": "array", "items": {"type": "object", "required": ["id", "kind", "locator", "reason"], "properties": {"id": {"type": "string", "minLength": 1}, "kind": {"type": "string", "minLength": 1}, "locator": {"type": "string", "minLength": 1}, "reason": {"type": "string", "minLength": 1}}, "additionalProperties": false}},
    "risks": {"type": "array", "items": {"type": "string", "minLength": 1}, "uniqueItems": true},
    "verdict": {"enum": ["passed", "failed", "blocked"]}
  },
  "additionalProperties": false
}
